name,email,phone,linkedin,Candidate_Location,open_to,summary,skills,education,job_title,company,Job_Location,employment_type,experience,salary,team_size,interview_rounds,required_skills,nice_to_have,perks,domain,match_score,match_label
Ananya Mehta,ananya.mehta97@gmail.com,+91-9275904742,linkedin.com/in/ananya-mehta7,"Chennai, India",Remote / Hybrid,Product designer with 2 years at OYO working across mobile and web platforms. Shipped 15+ end-to-end design projects. Passionate about Accounting and inclusive design.,"Treasury, M&A, IFRS, Accounting, SAP, DCF Analysis, Tax Compliance",B.Des in Interaction Design | Manipal Gurgaon | 2012 | CGPA: 7.9,Infrastructure Engineer,ICICI Bank,Jaipur / Remote,Full-Time,3+ years,₹16–42 LPA,~10,5,"Consul, HAProxy, Nginx, GCP, Site Reliability Engineering, GKE, GitLab CI, Linux, Istio","Bash, Grafana, Infrastructure as Code","MacBook Pro, Remote-first culture, Quarterly offsites, Mental health support",DevOps,0.37,no match
Karan Bose,karan.bose60@gmail.com,+91-8612939207,linkedin.com/in/karan-bose9,"Pune, India",Remote / Hybrid,"9+ years designing intuitive, accessible products at Infosys used by 31M+ users. Expert in dbt and PostgreSQL. Known for translating complex problems into elegant solutions.","PostgreSQL, Pandas, dbt, BERT, Hadoop, BigQuery, TensorFlow",B.F.A in Visual Communication | VIT Chennai | 2016 | CGPA: 7.9 || ---,Infrastructure Engineer,Microsoft,Gurgaon / Remote,Full-Time,5+ years,₹11–39 LPA,~33,4,"Site Reliability Engineering, Grafana, Istio, EKS, Datadog, Helm, GCP, New Relic, ArgoCD, Linux","Ansible, GitLab CI, GKE","Gym membership, Remote-first culture, MacBook Pro, Annual performance bonus",DevOps,0.38,no match
Harish Mishra,harish.mishra31@gmail.com,+91-7249716007,linkedin.com/in/harish-mishra3,"Mumbai, India",Remote / Hybrid,Full-stack engineer with 9 years at companies like ShareChat. Strong in Vue.js and React. Led rewrites of legacy systems to modern microservices architecture.,"Java, JavaScript, Django, Elasticsearch, RabbitMQ, CI/CD, React, Vue.js",M.Tech in Software Engineering | BITS Pilani Bangalore | 2014 | CGPA: 8.6,Backend Developer,Infosys,Kolkata / Remote,Full-Time,2+ years,₹13–40 LPA,~28,3,"MongoDB, Angular, Git, GCP, SQL, CI/CD, React, C++, Spring Boot","Linux, GraphQL, Java","MacBook Pro, Health & dental insurance, Quarterly offsites, Mental health support, ESOPs, ₹50K learning budget",Software Engineering,0.81,match
Swati Bose,swati.bose24@gmail.com,+91-8708910536,linkedin.com/in/swati-bose4,"Gurgaon, India",Remote / Hybrid,"UX researcher and designer with 3 years. Conducted 26+ user studies that directly shaped roadmap decisions. Proficient in Adobe XD, CRM and Market Research.","Zeplin, Adobe XD, A/B Testing, Framer, Lottie, Market Research, CRM, Marketing Automation",B.F.A in Visual Communication | VIT Noida | 2010 | CGPA: 7.8 || ---,Design Systems Engineer,Infosys,Delhi / Remote,Full-Time,5+ years,₹29–41 LPA,~7,4,"Usability Testing, User Research, Motion Design, InVision, Wireframing, User Flows, Accessibility (WCAG), Zeplin, Card Sorting, A/B Testing","Heuristic Evaluation, Design Systems, Figma","Flexible work hours, MacBook Pro, ₹50K learning budget, Health & dental insurance, Remote-first culture, Free meals",UI/UX Design,0.46,partial match
Suresh Mishra,suresh.mishra38@gmail.com,+91-8228736988,linkedin.com/in/suresh-mishra1,"Noida, India",Remote / Hybrid,"Security engineer with 6 years building and operating SOC capabilities at EY. Expert in GitLab CI, Python and threat hunting. Reduced MTTD by 74%.","Datadog, GCP, Python, GitLab CI",CEH Certified | NIT Jaipur | 2009 | CGPA: 7.6 || ---,Platform Engineer,Infosys,Bangalore / Remote,Full-Time,7+ years,₹13–34 LPA,~6,6,"Istio, Docker, Prometheus, Bash, Loki, Service Mesh, Terraform, Kubernetes, HAProxy, Pulumi","Vault, GCP, New Relic","MacBook Pro, Quarterly offsites, Free meals, Maternity/paternity leave, Gym membership",DevOps,0.21,no match
Harish Dubey,harish.dubey90@gmail.com,+91-9841657160,linkedin.com/in/harish-dubey7,"Gurgaon, India",Remote / Hybrid,"6+ years in offensive and defensive security at KPMG. Conducted 47+ penetration tests across web, mobile, and infrastructure. Holder of Visual Design and Framer certifications.","Prototyping, Framer, Visual Design, Card Sorting, Principle, Motion Design, Figma, Accessibility (WCAG)",CEH Certified | Manipal Kolkata | 2012 | CGPA: 9.7 || ---,Interaction Designer,upGrad,Delhi / Remote,Full-Time,8+ years,₹27–38 LPA,~25,3,"Design Thinking, User Flows, Framer, Lottie, Adobe XD, Sketch, Interaction Design, Design Systems, Motion Design, Storyboarding","Heuristic Evaluation, User Research, InVision","Gym membership, MacBook Pro, ₹50K learning budget, Annual performance bonus, Flexible work hours, Remote-first culture",UI/UX Design,0.08,no match
Dev Tiwari,dev.tiwari72@gmail.com,+91-7938543226,linkedin.com/in/dev-tiwari3,"Hyderabad, India",Remote / Hybrid,"Performance marketer with 2 years scaling user acquisition at MakeMyTrip. Expert in Google Analytics, Affiliate Marketing and PR. Grew organic traffic by 77% YoY.","Google Analytics, Marketo, Salesforce, Conversion Rate Optimisation, Adobe Suite, Video Marketing, Affiliate Marketing, PR, Content Marketing, SEM",MBA in Marketing | NIT Chennai | 2015 | CGPA: 8.3 || ---,Digital Marketing Manager,Capgemini,Bangalore / Remote,Full-Time,4+ years,₹26–41 LPA,~36,3,"PPC, Google Analytics, PR, HubSpot, Influencer Marketing, Salesforce, Affiliate Marketing","LinkedIn Ads, SEM, Community Management","₹50K learning budget, Flexible work hours, Quarterly offsites, Health & dental insurance",Marketing,0.87,match
Vikram Verma,vikram.verma92@gmail.com,+91-7739204690,linkedin.com/in/vikram-verma3,"Kolkata, India",Remote / Hybrid,"Data scientist with 12 years applying Python, C++ and MLflow to solve complex business problems. Experience across recommendation systems, fraud detection, and demand forecasting.","Spark, MLflow, Python, Keras, Transformers, Kubeflow, Redis, C++, JavaScript",B.Sc in Statistics | NMIMS Ahmedabad | 2009 | CGPA: 8.9 || ---,Sales Manager,Wipro,Jaipur / Remote,Full-Time,4+ years,₹25–40 LPA,~15,4,"HubSpot, Salesforce, SaaS Sales, Channel Partnerships, Proposal Writing, Demo Skills, Pipeline Management","Customer Success, Cold Outreach, SDR","Flexible work hours, Remote-first culture, MacBook Pro, Annual performance bonus, Mental health support, Gym membership",Sales,0.73,partial match
Aryan Singh,aryan.singh20@gmail.com,+91-8250898378,linkedin.com/in/aryan-singh8,"Kolkata, India",Remote / Hybrid,"SRE with 6 years ensuring 29% availability for systems serving 46M+ users at Oracle. Passionate about Datadog, observability, and eliminating toil.","Jenkins, ArgoCD, Prometheus, Loki, Datadog, New Relic, Linux, Istio, FluxCD, Nginx",AWS Certified Solutions Architect | NMIMS Pune | 2013 | CGPA: 8.3 || ---,DevOps Engineer,Meta,Noida / Remote,Full-Time,5+ years,₹17–60 LPA,~24,6,"GKE, Bash, Service Mesh, Consul, Python, HAProxy, Linux, CloudFormation, Datadog","Site Reliability Engineering, Jenkins, New Relic","Mental health support, Maternity/paternity leave, Annual performance bonus, Gym membership",DevOps,0.81,match
Rohit Choudhary,rohit.choudhary21@gmail.com,+91-9597012539,linkedin.com/in/rohit-choudhary4,"Hyderabad, India",Remote / Hybrid,Full-stack engineer with 10 years at companies like Swiggy. Strong in GCP and Angular. Led rewrites of legacy systems to modern microservices architecture.,"GCP, Angular, Redis, GraphQL, Rust, DCF Analysis, Investment Banking, Risk Analysis",B.Sc in Computer Science | Delhi University Jaipur | 2010 | CGPA: 7.4,Staff Engineer,Infosys,Delhi / Remote,Full-Time,6+ years,₹25–35 LPA,~20,4,"System Design, C++, Kafka, Spring Boot, CI/CD, Terraform, JavaScript","TypeScript, Java, Git","MacBook Pro, Remote-first culture, Annual performance bonus, Free meals",Software Engineering,0.6,partial match
Varun Das,varun.das92@gmail.com,+91-8532962151,linkedin.com/in/varun-das2,"Gurgaon, India",Remote / Hybrid,"Performance marketer with 11 years scaling user acquisition at Swiggy. Expert in Salesforce, Programmatic Advertising and Adobe Suite. Grew organic traffic by 76% YoY.","SEO, Google Ads, Salesforce, Brand Strategy, CRM, Programmatic Advertising, Influencer Marketing, Marketing Automation, Adobe Suite, Video Marketing",B.Sc in Mass Communication | Delhi University Kolkata | 2014 | CGPA: 9.7 || ---,CMO,Infosys,Delhi / Remote,Full-Time,6+ years,₹24–45 LPA,~30,6,"Google Ads, Marketing Automation, Brand Strategy, Email Marketing, Community Management, Copywriting, Salesforce, SEO","Meta Ads, Social Media, PPC","Annual performance bonus, Remote-first culture, MacBook Pro, Maternity/paternity leave",Marketing,0.86,match
Meera Desai,meera.desai71@gmail.com,+91-8860474498,linkedin.com/in/meera-desai1,"Gurgaon, India",Remote / Hybrid,Cloud architect with 4 years at Capgemini designing multi-region infrastructure on Consul and Python. Reduced infrastructure spend by ₹31Cr through right-sizing and reserved instances.,"Vault, Consul, Service Mesh, Terraform, Python, Azure, Prometheus, Onboarding, Talent Acquisition, Change Management",CKA Certified | VIT Bangalore | 2010 | CGPA: 9.6,Infrastructure Engineer,Paytm,Jaipur / Remote,Full-Time,7+ years,₹20–36 LPA,~10,5,"Site Reliability Engineering, Prometheus, Azure, GKE, ArgoCD, FluxCD, GitHub Actions, Terraform, New Relic, Jenkins","Pulumi, GitLab CI, Infrastructure as Code","Gym membership, Remote-first culture, MacBook Pro, Annual performance bonus, Flexible work hours",DevOps,0.52,partial match
Ishita Saxena,ishita.saxena61@gmail.com,+91-9890755330,linkedin.com/in/ishita-saxena9,"Chennai, India",Remote / Hybrid,Enterprise sales professional with 2 years at Zerodha selling Cold Outreach solutions to C-suite buyers. Built and managed pipeline of ₹45Cr+ across 9 industry verticals.,"HubSpot, Lead Generation, Cold Outreach, LinkedIn Sales Navigator, Negotiation, Cross-selling, SPIN Selling, Enterprise Sales",MBA in Sales & Marketing | BITS Pilani Bangalore | 2022 | CGPA: 7.3 || ---,Business Development Manager,Freshworks,Delhi / Remote,Full-Time,5+ years,₹17–33 LPA,~18,6,"Revenue Forecasting, Account Management, SPIN Selling, LinkedIn Sales Navigator, Pipeline Management, CRM, SaaS Sales, Upselling","HubSpot, Negotiation, Cross-selling","Flexible work hours, Quarterly offsites, Health & dental insurance, ESOPs, MacBook Pro, Maternity/paternity leave",Sales,0.8,match
Dev Malhotra,dev.malhotra75@gmail.com,+91-8733578691,linkedin.com/in/dev-malhotra9,"Hyderabad, India",Remote / Hybrid,"Talent acquisition specialist with 7 years. Hired 33+ candidates across tech, product, and business functions. Passionate about CRM and data-driven recruiting.","Diversity & Inclusion, SuccessFactors, HR Analytics, Labor Law, Growth Hacking, Community Management, CRM, Email Marketing",M.Sc in Organisational Psychology | BITS Pilani Ahmedabad | 2018 | CGPA: 9.1 || ---,HR Business Partner,CRED,Ahmedabad / Remote,Full-Time,6+ years,₹29–73 LPA,~24,3,"Employer Branding, Conflict Resolution, Exit Management, Payroll, HR Analytics, Onboarding, Employee Relations, Organisational Development, Labor Law, SAP HR","HRMS, Performance Management, Training & Development","Free meals, MacBook Pro, Annual performance bonus, Gym membership",Human Resources,0.73,partial match
Aisha Menon,aisha.menon75@gmail.com,+91-7570752608,linkedin.com/in/aisha-menon7,"Pune, India",Remote / Hybrid,"DevOps engineer with 8+ years building cloud-native infrastructure at MakeMyTrip. Managed 32K+ container workloads on Kubernetes. Expert in GitHub Actions, Datadog and TypeScript.","Azure, GitHub Actions, Nginx, ArgoCD, Datadog, TypeScript, Terraform",B.E. in IT | VIT Pune | 2021 | CGPA: 7.2 || ---,DevOps Engineer,Zomato,Bangalore / Remote,Full-Time,6+ years,₹17–42 LPA,~9,4,"Azure, Prometheus, Terraform, Ansible, AWS, Loki, Jenkins, GitLab CI, Bash","Infrastructure as Code, Consul, Istio","Gym membership, Annual performance bonus, Quarterly offsites, ₹50K learning budget, Health & dental insurance, Flexible work hours",DevOps,0.72,partial match
Karan Agarwal,karan.agarwal18@gmail.com,+91-7272938069,linkedin.com/in/karan-agarwal4,"Pune, India",Remote / Hybrid,"Talent acquisition specialist with 12 years. Hired 25+ candidates across tech, product, and business functions. Passionate about Infrastructure as Code and data-driven recruiting.","Site Reliability Engineering, Loki, Infrastructure as Code, GKE",M.A. in Labour Relations | NIT Mumbai | 2011 | CGPA: 8.1 || ---,Digital Marketing Manager,HDFC Bank,Jaipur / Remote,Full-Time,7+ years,₹16–55 LPA,~25,6,"Email Marketing, SEM, Marketing Automation, Salesforce, Market Research, Google Ads, Programmatic Advertising","Brand Strategy, Google Analytics, Growth Hacking","Free meals, Gym membership, Annual performance bonus, Maternity/paternity leave",Marketing,0.14,no match
Kunal Mishra,kunal.mishra17@gmail.com,+91-8323918197,linkedin.com/in/kunal-mishra8,"Chennai, India",Remote / Hybrid,"DevOps engineer with 4+ years building cloud-native infrastructure at Freshworks. Managed 50K+ container workloads on Kubernetes. Expert in PKI, FluxCD and Jenkins.","GitLab CI, Go, Jenkins, Service Mesh, Loki, FluxCD, PKI, Splunk",B.Sc in Computer Science | NMIMS Kochi | 2016 | CGPA: 9.6,Staff Engineer,Mphasis,Bangalore / Remote,Full-Time,3+ years,₹17–39 LPA,~5,3,"GCP, Vue.js, Angular, Rust, SQL, PostgreSQL, Java","MongoDB, Docker, RabbitMQ","ESOPs, Free meals, Health & dental insurance, Mental health support, ₹50K learning budget, Remote-first culture",Software Engineering,0.61,partial match
Natasha Sethi,natasha.sethi59@gmail.com,+91-7378808160,linkedin.com/in/natasha-sethi3,"Kolkata, India",Remote / Hybrid,Enterprise sales professional with 9 years at Meesho selling Cross-selling solutions to C-suite buyers. Built and managed pipeline of ₹23Cr+ across 7 industry verticals.,"SPIN Selling, Cross-selling, B2B Sales, CRM, Terraform, Python, GCP, REST APIs",BBA | BITS Pilani Noida | 2019 | CGPA: 8.2 || ---,SEO Specialist,InMobi,Delhi / Remote,Full-Time,2+ years,₹20–46 LPA,~15,6,"Email Marketing, Marketo, Brand Strategy, PPC, Market Research, Programmatic Advertising, Marketing Automation, PR","Conversion Rate Optimisation, Video Marketing, Social Media","Gym membership, Free meals, Annual performance bonus, Maternity/paternity leave, ₹50K learning budget, Health & dental insurance",Marketing,0.43,partial match
Kabir Iyer,kabir.iyer43@gmail.com,+91-8450006976,linkedin.com/in/kabir-iyer2,"Bangalore, India",Remote / Hybrid,"Talent acquisition specialist with 8 years. Hired 50+ candidates across tech, product, and business functions. Passionate about PRD Writing and data-driven recruiting.","Amplitude, Stakeholder Management, Competitive Analysis, A/B Testing, Kanban, Confluence, MoSCoW, PRD Writing",M.A. in Labour Relations | Manipal Kolkata | 2014 | CGPA: 8.5 || ---,Data Scientist,Google,Pune / Remote,Full-Time,4+ years,₹10–20 LPA,~20,4,"Hadoop, dbt, Time Series, R, Transformers, LightGBM, Kafka, TensorFlow","Looker, Keras, Airflow","MacBook Pro, Mental health support, Free meals, Maternity/paternity leave, Quarterly offsites, Flexible work hours",Data Science,0.28,no match
Aakash Das,aakash.das98@gmail.com,+91-9332107967,linkedin.com/in/aakash-das7,"Hyderabad, India",Remote / Hybrid,"5+ years designing intuitive, accessible products at ICICI Bank used by 10M+ users. Expert in Framer and Usability Testing. Known for translating complex problems into elegant solutions.","Adobe XD, Framer, Prototyping, Wireframing, Usability Testing, Interaction Design, Information Architecture, Accessibility (WCAG), Heuristic Evaluation, A/B Testing, Motion Design",Diploma in UI/UX | NIT Kochi | 2022 | CGPA: 7.6 || ---,UX Researcher,Cognizant,Mumbai / Remote,Full-Time,1+ years,₹29–60 LPA,~8,4,"Information Architecture, Prototyping, InVision, Storyboarding, Lottie, Framer, Card Sorting","Motion Design, Interaction Design, Sketch","Quarterly offsites, ESOPs, Annual performance bonus, Health & dental insurance",UI/UX Design,0.87,match
Dev Patel,dev.patel39@gmail.com,+91-7161777067,linkedin.com/in/dev-patel6,"Jaipur, India",Remote / Hybrid,Full-stack engineer with 7 years at companies like Zoho. Strong in Figma and Design Thinking. Led rewrites of legacy systems to modern microservices architecture.,"Wireframing, Figma, Design Systems, Design Thinking, Motion Design",B.Sc in Computer Science | NMIMS Noida | 2016 | CGPA: 7.3,Head of Design,Vedantu,Delhi / Remote,Full-Time,6+ years,₹22–42 LPA,~30,5,"Heuristic Evaluation, User Research, Design Systems, Zeplin, User Flows, Accessibility (WCAG), Wireframing, Storyboarding, Figma, Information Architecture","Card Sorting, Adobe XD, Visual Design","Health & dental insurance, ₹50K learning budget, ESOPs, Free meals, Annual performance bonus",UI/UX Design,0.19,no match
Kavya Joshi,kavya.joshi33@gmail.com,+91-9393549438,linkedin.com/in/kavya-joshi5,"Delhi, India",Remote / Hybrid,"5+ years in offensive and defensive security at Razorpay. Conducted 32+ penetration tests across web, mobile, and infrastructure. Holder of PRD Writing and Competitive Analysis certifications.","User Research, MoSCoW, Confluence, Amplitude, PRD Writing, Competitive Analysis",M.Tech in Information Security | IIM Ahmedabad | 2014 | CGPA: 9.5 || ---,Data Analyst,MakeMyTrip,Ahmedabad / Remote,Full-Time,6+ years,₹15–50 LPA,~33,5,"NumPy, Tableau, BigQuery, Power BI, Computer Vision, XGBoost, PyTorch, Redshift, Python, Scikit-learn","Keras, Data Modeling, Kafka","MacBook Pro, Mental health support, Maternity/paternity leave, Gym membership, Free meals",Data Science,0.06,no match
Yash Mishra,yash.mishra26@gmail.com,+91-9367176821,linkedin.com/in/yash-mishra8,"Noida, India",Remote / Hybrid,"Strategic HRBP with 2 years partnering with business leaders at boAt. Expert in Excel, Tally and building high-performance cultures in fast-scaling organisations.","Excel, Tally, DCF Analysis, Budgeting",B.A. in Psychology | IIM Kolkata | 2015 | CGPA: 7.3 || ---,Director of Product,Razorpay,Ahmedabad / Remote,Full-Time,1+ years,₹22–71 LPA,~22,5,"Agile, OKRs, SQL, Feature Prioritisation, Competitive Analysis, RICE Framework","Product Analytics, PRD Writing, Growth Hacking","Maternity/paternity leave, Annual performance bonus, ₹50K learning budget, Health & dental insurance",Product Management,0.15,no match
Shruti Patel,shruti.patel99@gmail.com,+91-9431472326,linkedin.com/in/shruti-patel3,"Noida, India",Remote / Hybrid,CA/MBA with 10+ years in Information Architecture and Zeplin at Morgan Stanley. Managed portfolios worth ₹46Cr. Strong track record in cost reduction and financial optimisation.,"Storyboarding, Lottie, Zeplin, A/B Testing, Information Architecture",M.Com in Accounting | VIT Gurgaon | 2021 | CGPA: 7.7 || ---,SEO Specialist,Adobe,Noida / Remote,Full-Time,2+ years,₹30–50 LPA,~23,4,"Copywriting, Meta Ads, Video Marketing, Google Analytics, Influencer Marketing, Market Research, Adobe Suite, CRM, Programmatic Advertising, LinkedIn Ads","Content Marketing, Marketing Automation, Email Marketing","Free meals, Mental health support, Health & dental insurance, Gym membership",Marketing,0.07,no match
Kabir Arora,kabir.arora64@gmail.com,+91-7535261278,linkedin.com/in/kabir-arora7,"Delhi, India",Remote / Hybrid,8+ years as a ML Engineer specialising in KPIs and Usability Testing. Built production ML systems at TCS serving 50M+ users. Published 2 internal research papers.,"KPIs, Feature Prioritisation, Usability Testing, MoSCoW, Product Analytics, A/B Testing, Competitive Analysis",B.Tech in Computer Science | IIM Kochi | 2009 | CGPA: 9.3 || ---,SDR,PwC,Gurgaon / Remote,Full-Time,4+ years,₹25–59 LPA,~8,5,"Enterprise Sales, BDR, Customer Success, Salesforce, MEDDIC, Demo Skills, Revenue Forecasting, LinkedIn Sales Navigator, Proposal Writing","B2B Sales, Pipeline Management, HubSpot","Free meals, Maternity/paternity leave, Annual performance bonus, MacBook Pro, ESOPs",Sales,0.31,no match
Rishabh Shah,rishabh.shah31@gmail.com,+91-8958168879,linkedin.com/in/rishabh-shah7,"Ahmedabad, India",Remote / Hybrid,"SRE with 3 years ensuring 23% availability for systems serving 5M+ users at Zoho. Passionate about Azure, observability, and eliminating toil.","Azure, Loki, Terraform, Grafana, ArgoCD, AWS, Succession Planning, Talent Acquisition, Change Management, HRIS",B.Tech in Computer Science | Manipal Chennai | 2018 | CGPA: 7.2,Head of DevOps,Meta,Noida / Remote,Full-Time,8+ years,₹25–49 LPA,~29,4,"Grafana, Python, GCP, Go, Istio, Bash, Prometheus, Infrastructure as Code, Datadog","Azure, Kubernetes, Pulumi","Flexible work hours, Free meals, Gym membership, Health & dental insurance, Maternity/paternity leave",DevOps,0.6,partial match
Suresh Menon,suresh.menon66@gmail.com,+91-8606257674,linkedin.com/in/suresh-menon1,"Kochi, India",Remote / Hybrid,InfoSec professional with 8 years at Infosys specialising in Forensics and cloud security. Led organisation through ISO 27001 certification and 33+ audits.,"Splunk, SOC Operations, Incident Response, CISSP, Bash, Burp Suite, Forensics, Metasploit, IAM, Cryptography",M.Tech in Information Security | NMIMS Kolkata | 2022 | CGPA: 7.4 || ---,Cloud Security Engineer,upGrad,Pune / Remote,Full-Time,9+ years,₹18–50 LPA,~9,3,"Forensics, Threat Intelligence, Python, Metasploit, OWASP Top 10, Zero Trust","Wireshark, Incident Response, NIST Framework","Gym membership, Mental health support, Remote-first culture, Annual performance bonus, Quarterly offsites",Cybersecurity,0.86,match
Aisha Reddy,aisha.reddy17@gmail.com,+91-7492061697,linkedin.com/in/aisha-reddy3,"Noida, India",Remote / Hybrid,"DevOps engineer with 11+ years building cloud-native infrastructure at Groww. Managed 45K+ container workloads on Kubernetes. Expert in Investment Banking, Financial Modeling and CFA.","CFA, Investment Banking, Tally, Financial Modeling, CA, Treasury",B.Tech in Computer Science | Manipal Hyderabad | 2010 | CGPA: 7.4 || ---,Frontend Developer,upGrad,Bangalore / Remote,Full-Time,2+ years,₹8–43 LPA,~18,3,"Rust, Python, Redis, Kafka, Java, Terraform, Kubernetes","REST APIs, Go, Spring Boot","ESOPs, Annual performance bonus, Quarterly offsites, Maternity/paternity leave, Flexible work hours",Software Engineering,0.25,no match
Arjun Iyer,arjun.iyer95@gmail.com,+91-9850721503,linkedin.com/in/arjun-iyer9,"Kochi, India",Remote / Hybrid,Full-stack engineer with 9 years at companies like Zomato. Strong in FastAPI and MongoDB. Led rewrites of legacy systems to modern microservices architecture.,"JavaScript, Rust, React, Angular, Vue.js, FastAPI, SQL, MongoDB, Jenkins, GraphQL, Go, Kafka",B.Tech in Computer Science | NMIMS Chennai | 2021 | CGPA: 8.3,Full Stack Developer,TCS,Ahmedabad / Remote,Full-Time,3+ years,₹22–65 LPA,~16,6,"System Design, Java, Terraform, Redis, GraphQL, Kafka, AWS","Linux, CI/CD, Jenkins","Flexible work hours, Mental health support, Annual performance bonus, Quarterly offsites",Software Engineering,0.97,match
Sneha Kulkarni,sneha.kulkarni34@gmail.com,+91-7783314618,linkedin.com/in/sneha-kulkarni4,"Ahmedabad, India",Remote / Hybrid,"Finance professional with 5 years at Cognizant specialising in Excel, HubSpot and regulatory compliance. Led teams through 18+ successful audits.","Valuation, Excel, Treasury, QuickBooks, HubSpot, B2B Sales",B.Com in Finance | VIT Kochi | 2019 | CGPA: 8.8 || ---,Audit Associate,Razorpay,Pune / Remote,Full-Time,9+ years,₹14–24 LPA,~10,4,"VBA, Financial Reporting, Risk Analysis, GAAP, QuickBooks, Auditing, Financial Modeling, Investment Banking, CFA","SAP, Budgeting, DCF Analysis","ESOPs, Remote-first culture, Free meals, Quarterly offsites",Finance,0.68,partial match
Zara Iyer,zara.iyer98@gmail.com,+91-9953042013,linkedin.com/in/zara-iyer3,"Kochi, India",Remote / Hybrid,Investment analyst with 10 years covering GAAP and Accounting. Built 47+ financial models supporting ₹6Cr+ in deals. CFA Level 2 cleared.,"Excel, Valuation, GAAP, Oracle Financials, FP&A, Auditing, CFA, Accounting, SAP, DCF Analysis",MBA in Finance | Manipal Pune | 2010 | CGPA: 7.6 || ---,Senior Financial Analyst,Goldman Sachs,Jaipur / Remote,Full-Time,4+ years,₹13–29 LPA,~5,6,"Auditing, DCF Analysis, Credit Analysis, SAP, Treasury, Due Diligence, GAAP, IFRS, Oracle Financials, Bloomberg Terminal","CFA, Equity Research, LBO Modeling","Health & dental insurance, Free meals, Gym membership, Maternity/paternity leave, Annual performance bonus, ESOPs",Finance,0.97,match
Shreya Pillai,shreya.pillai63@gmail.com,+91-8531785885,linkedin.com/in/shreya-pillai5,"Bangalore, India",Remote / Hybrid,Product designer with 9 years at Deloitte working across mobile and web platforms. Shipped 10+ end-to-end design projects. Passionate about Budgeting and inclusive design.,"User Flows, Framer, Motion Design, HTML/CSS, Risk Analysis, Budgeting, Auditing, IFRS",Diploma in UI/UX | VIT Ahmedabad | 2018 | CGPA: 7.8,Design Systems Engineer,Netflix,Bangalore / Remote,Full-Time,4+ years,₹28–66 LPA,~22,5,"Framer, Sketch, InVision, Zeplin, HTML/CSS, Interaction Design, User Flows","Adobe XD, A/B Testing, Storyboarding","Free meals, Remote-first culture, Gym membership, ESOPs, ₹50K learning budget, Maternity/paternity leave",UI/UX Design,0.6,partial match
