name,email,phone,linkedin,Candidate_Location,open_to,summary,skills,education,job_title,company,Job_Location,employment_type,experience,salary,team_size,interview_rounds,required_skills,nice_to_have,perks,domain,match_score,match_label
Pooja Chatterjee,pooja.chatterjee93@gmail.com,+91-7773355906,linkedin.com/in/pooja-chatterjee8,"Pune, India",Remote / Hybrid,"10+ years in offensive and defensive security at Paytm. Conducted 6+ penetration tests across web, mobile, and infrastructure. Holder of QuickBooks and Financial Modeling certifications.","Bloomberg Terminal, QuickBooks, VBA, Budgeting, Financial Modeling, SAP, Auditing, DCF Analysis",CISSP Certified | NIT Mumbai | 2010 | CGPA: 9.0,UX Researcher,upGrad,Gurgaon / Remote,Full-Time,8+ years,₹24–63 LPA,~20,5,"Usability Testing, Zeplin, Sketch, Principle, Figma, User Research, Heuristic Evaluation, Lottie, Card Sorting, Prototyping","Information Architecture, A/B Testing, HTML/CSS","Free meals, MacBook Pro, Remote-first culture, Quarterly offsites, ₹50K learning budget",UI/UX Design,0.11,no match
Aisha Bose,aisha.bose40@gmail.com,+91-8128222260,linkedin.com/in/aisha-bose6,"Delhi, India",Remote / Hybrid,"ML engineer with 4 years at HCL bridging research and production. Expert in Pandas and Kubernetes model deployment, monitoring, and retraining pipelines.","A/B Testing, Pandas, Scikit-learn, Keras, NumPy, Hive, CloudFormation, Kubernetes, Jenkins, Python",M.Sc in Data Science | IIM Bangalore | 2015 | CGPA: 9.4 || ---,Research Scientist,Byju's,Kolkata / Remote,Full-Time,2+ years,₹26–55 LPA,~26,5,"Statistics, Redshift, PostgreSQL, PyTorch, Power BI, BigQuery","XGBoost, Kubeflow, BERT","MacBook Pro, Flexible work hours, ₹50K learning budget, Free meals, Maternity/paternity leave, Remote-first culture",Data Science,0.69,partial match
Neha Arora,neha.arora68@gmail.com,+91-9782750612,linkedin.com/in/neha-arora3,"Ahmedabad, India",Remote / Hybrid,"SRE with 12 years ensuring 68% availability for systems serving 49M+ users at Unilever. Passionate about Vault, observability, and eliminating toil.","New Relic, Nginx, Vault, Grafana, RabbitMQ, React, gRPC",B.Sc in Computer Science | VIT Jaipur | 2012 | CGPA: 8.3 || ---,Head of DevOps,Meta,Hyderabad / Remote,Full-Time,5+ years,₹24–40 LPA,~33,4,"EKS, Nginx, GitHub Actions, Jenkins, FluxCD, CloudFormation, Linux, Docker, Consul","Bash, AWS, Prometheus","Remote-first culture, Annual performance bonus, ₹50K learning budget, Quarterly offsites, Mental health support",DevOps,0.43,partial match
Harish Bhatt,harish.bhatt17@gmail.com,+91-7273646726,linkedin.com/in/harish-bhatt9,"Kolkata, India",Remote / Hybrid,"Security engineer with 6 years building and operating SOC capabilities at Nykaa. Expert in NumPy, Hive and threat hunting. Reduced MTTD by 14%.","Python, Tableau, NumPy, XGBoost, Hive, Airflow, Looker",B.Tech in Cybersecurity | IIM Mumbai | 2011 | CGPA: 7.9 || ---,Senior Software Engineer,Google,Mumbai / Remote,Full-Time,7+ years,₹19–46 LPA,~32,5,"TypeScript, Elasticsearch, Terraform, Redis, Node.js, FastAPI","JavaScript, Azure, RabbitMQ","Remote-first culture, Mental health support, ₹50K learning budget, ESOPs, Annual performance bonus",Software Engineering,0.1,no match
Rohan Iyer,rohan.iyer44@gmail.com,+91-7672100521,linkedin.com/in/rohan-iyer9,"Kolkata, India",Remote / Hybrid,"Security engineer with 11 years building and operating SOC capabilities at HDFC Bank. Expert in Workday, Onboarding and threat hunting. Reduced MTTD by 58%.","Onboarding, Workforce Planning, Change Management, Conflict Resolution, Organisational Development, Workday, SuccessFactors",B.Tech in Cybersecurity | VIT Chennai | 2016 | CGPA: 7.3 || ---,Head of HR,Deloitte,Hyderabad / Remote,Full-Time,4+ years,₹29–73 LPA,~6,4,"HRIS, HRMS, LinkedIn Recruiter, Training & Development, Payroll, Change Management, Onboarding, Succession Planning","Exit Management, SAP HR, Conflict Resolution","Quarterly offsites, MacBook Pro, Flexible work hours, Annual performance bonus",Human Resources,0.33,no match
Suresh Pillai,suresh.pillai39@gmail.com,+91-7519808262,linkedin.com/in/suresh-pillai6,"Delhi, India",Remote / Hybrid,"9+ years in offensive and defensive security at Salesforce. Conducted 29+ penetration tests across web, mobile, and infrastructure. Holder of SIEM and Metasploit certifications.","Penetration Testing, SIEM, Splunk, Python, Metasploit, Burp Suite, NIST Framework, Cloud Security (AWS/GCP)",M.S. in Cybersecurity | BITS Pilani Jaipur | 2019 | CGPA: 9.5 || ---,Cloud Security Engineer,Groww,Kochi / Remote,Full-Time,9+ years,₹26–53 LPA,~13,5,"Incident Response, Network Security, PKI, CISSP, ISO 27001, OSCP, SIEM, Firewalls, Cloud Security (AWS/GCP), Zero Trust","Python, Splunk, CEH","₹50K learning budget, Quarterly offsites, Maternity/paternity leave, Annual performance bonus, Mental health support",Cybersecurity,0.95,match
Aditi Naidu,aditi.naidu96@gmail.com,+91-7811946843,linkedin.com/in/aditi-naidu7,"Jaipur, India",Remote / Hybrid,6+ years driving growth through Content Marketing and Salesforce at Byju's. Managed ₹20Cr+ annual marketing budgets. Consistently delivered 10%+ ROI on campaigns.,"SEO, Meta Ads, Content Marketing, Copywriting, Growth Hacking, Conversion Rate Optimisation, Marketing Automation, LinkedIn Ads, Affiliate Marketing, Salesforce",B.Sc in Mass Communication | Delhi University Gurgaon | 2021 | CGPA: 8.1,Growth Manager,CRED,Hyderabad / Remote,Full-Time,4+ years,₹22–49 LPA,~17,4,"Social Media, Marketing Automation, CRM, Meta Ads, Programmatic Advertising, Google Ads","Salesforce, Marketo, Growth Hacking","ESOPs, Mental health support, Annual performance bonus, Flexible work hours, ₹50K learning budget",Marketing,0.77,match
Deepak Das,deepak.das21@gmail.com,+91-7833229917,linkedin.com/in/deepak-das8,"Jaipur, India",Remote / Hybrid,5+ years driving growth through HRMS and Workday at Accenture. Managed ₹18Cr+ annual marketing budgets. Consistently delivered 43%+ ROI on campaigns.,"Organisational Development, Performance Management, LinkedIn Recruiter, SAP HR, HRMS, Talent Acquisition, Workday, Change Management",MBA in Marketing | IIM Noida | 2020 | CGPA: 9.5,Research Scientist,HDFC Bank,Kolkata / Remote,Full-Time,9+ years,₹10–29 LPA,~23,3,"Feature Engineering, Data Modeling, Time Series, NLP, Hive, Scikit-learn, Statistics","Kubeflow, R, MLflow","MacBook Pro, Health & dental insurance, Mental health support, Remote-first culture, ₹50K learning budget, Annual performance bonus",Data Science,0.28,no match
Nandini Patel,nandini.patel12@gmail.com,+91-7341838807,linkedin.com/in/nandini-patel6,"Kolkata, India",Remote / Hybrid,"Finance professional with 4 years at boAt specialising in Accounting, IFRS and regulatory compliance. Led teams through 36+ successful audits.","Valuation, IFRS, Accounting, Equity Research, Due Diligence, SAP, Credit Analysis, FluxCD, Site Reliability Engineering, GitHub Actions",B.Com in Finance | NIT Kochi | 2014 | CGPA: 7.5,Credit Analyst,CRED,Hyderabad / Remote,Full-Time,2+ years,₹15–41 LPA,~30,3,"Tax Compliance, Due Diligence, GAAP, SAP, Financial Reporting, Budgeting, CFA","Auditing, Investment Banking, IFRS","Annual performance bonus, Mental health support, ₹50K learning budget, Flexible work hours, Gym membership, Health & dental insurance",Finance,0.64,partial match
Pallavi Verma,pallavi.verma29@gmail.com,+91-7795387715,linkedin.com/in/pallavi-verma5,"Pune, India",Remote / Hybrid,HR leader with 5+ years at upGrad specialising in Usability Testing and Compensation & Benefits. Built hiring pipelines for 48+ roles annually. Reduced attrition by 54% through targeted retention programmes.,"Compensation & Benefits, Employee Relations, SAP HR, Change Management, Succession Planning, Onboarding, Sketch, Principle, Usability Testing",M.A. in Labour Relations | NIT Gurgaon | 2012 | CGPA: 9.7 || ---,Design Lead,Atlassian,Mumbai / Remote,Full-Time,8+ years,₹10–47 LPA,~15,3,"Design Systems, Visual Design, Adobe XD, Lottie, Card Sorting, Design Thinking, Interaction Design, Zeplin","Information Architecture, User Research, Heuristic Evaluation","Health & dental insurance, Free meals, MacBook Pro, Mental health support, ESOPs",UI/UX Design,0.51,partial match
Amit Pillai,amit.pillai69@gmail.com,+91-8120246334,linkedin.com/in/amit-pillai1,"Kolkata, India",Remote / Hybrid,"Performance marketer with 6 years scaling user acquisition at Paytm. Expert in Influencer Marketing, Salesforce and Copywriting. Grew organic traffic by 37% YoY.","SEM, Google Analytics, Salesforce, Email Marketing, Copywriting, Brand Strategy, Influencer Marketing, Conversion Rate Optimisation",M.A. in Communications | IIT Noida | 2017 | CGPA: 8.6 || ---,Performance Marketer,Accenture,Gurgaon / Remote,Full-Time,1+ years,₹19–67 LPA,~33,5,"PPC, Salesforce, Social Media, Influencer Marketing, Programmatic Advertising, Adobe Suite, Meta Ads, Content Marketing, Email Marketing, Google Ads","PR, LinkedIn Ads, Marketing Automation","MacBook Pro, ₹50K learning budget, Health & dental insurance, Annual performance bonus, Quarterly offsites, Flexible work hours",Marketing,0.86,match
Ishita Sinha,ishita.sinha76@gmail.com,+91-9565433770,linkedin.com/in/ishita-sinha4,"Delhi, India",Remote / Hybrid,Product designer with 6 years at Zomato working across mobile and web platforms. Shipped 11+ end-to-end design projects. Passionate about SEM and inclusive design.,"Motion Design, Figma, InVision, Framer, Visual Design, Interaction Design, User Flows, SEM, Copywriting",M.A. in Design | NMIMS Kochi | 2009 | CGPA: 9.3,Interaction Designer,Capgemini,Gurgaon / Remote,Full-Time,2+ years,₹29–40 LPA,~19,5,"Motion Design, Prototyping, Figma, Card Sorting, Information Architecture, Interaction Design, User Flows, Storyboarding","Design Systems, HTML/CSS, Principle","Health & dental insurance, Mental health support, Gym membership, ₹50K learning budget, Free meals",UI/UX Design,0.63,partial match
Sneha Nair,sneha.nair48@gmail.com,+91-9916051762,linkedin.com/in/sneha-nair2,"Chennai, India",Remote / Hybrid,9+ years as a Computer Vision Engineer specialising in Statistics and Demo Skills. Built production ML systems at Zerodha serving 33M+ users. Published 3 internal research papers.,"BERT, NLP, Statistics, Airflow, Looker, Demo Skills, Enterprise Sales, SPIN Selling",B.Sc in Statistics | BITS Pilani Gurgaon | 2012 | CGPA: 9.4,Sales Manager,upGrad,Chennai / Remote,Full-Time,7+ years,₹28–56 LPA,~36,4,"Account Management, BDR, Demo Skills, Proposal Writing, LinkedIn Sales Navigator, Enterprise Sales, Channel Partnerships","Cold Outreach, Pipeline Management, Contract Negotiation","Flexible work hours, Remote-first culture, Free meals, Health & dental insurance",Sales,0.7,partial match
Ishita Iyer,ishita.iyer65@gmail.com,+91-8390612805,linkedin.com/in/ishita-iyer4,"Bangalore, India",Remote / Hybrid,"4+ years designing intuitive, accessible products at ShareChat used by 47M+ users. Expert in Usability Testing and Figma. Known for translating complex problems into elegant solutions.","Figma, Adobe XD, Wireframing, User Research, Usability Testing, Interaction Design, Accessibility (WCAG), User Flows, Heuristic Evaluation, Storyboarding",B.F.A in Visual Communication | Delhi University Hyderabad | 2017 | CGPA: 9.4 || ---,Product Designer,Capgemini,Noida / Remote,Full-Time,1+ years,₹14–55 LPA,~6,5,"Framer, Principle, Figma, Information Architecture, A/B Testing, Usability Testing","Sketch, Storyboarding, Visual Design","MacBook Pro, Flexible work hours, Mental health support, ESOPs",UI/UX Design,0.8,match
Rahul Kumar,rahul.kumar45@gmail.com,+91-9375288920,linkedin.com/in/rahul-kumar3,"Ahmedabad, India",Remote / Hybrid,"Security engineer with 12 years building and operating SOC capabilities at Accenture. Expert in Cryptography, Threat Intelligence and threat hunting. Reduced MTTD by 58%.","Penetration Testing, SIEM, Cryptography, Metasploit, NIST Framework, PKI, Threat Intelligence, Burp Suite",M.S. in Cybersecurity | Manipal Hyderabad | 2011 | CGPA: 7.7 || ---,CISO,Paytm,Gurgaon / Remote,Full-Time,2+ years,₹9–37 LPA,~40,5,"Python, OSCP, Threat Intelligence, Firewalls, Forensics, CISSP, Cryptography, Vulnerability Assessment","SIEM, DLP, Network Security","Quarterly offsites, Flexible work hours, Remote-first culture, Mental health support, Maternity/paternity leave, ESOPs",Cybersecurity,0.77,match
Meera Malhotra,meera.malhotra94@gmail.com,+91-9452915121,linkedin.com/in/meera-malhotra3,"Hyderabad, India",Remote / Hybrid,"Product manager with 12 years driving 0-to-1 products and scaling existing ones. Deep expertise in Wireframing, Go-to-Market Strategy and working at the intersection of business, design, and engineering.","Wireframing, Figma, KPIs, Go-to-Market Strategy, MoSCoW, Growth Hacking, Amplitude, Confluence, Usability Testing, Python",B.E. in Electronics | NIT Kolkata | 2018 | CGPA: 8.2 || ---,Growth PM,Adobe,Gurgaon / Remote,Full-Time,8+ years,₹23–45 LPA,~5,4,"KPIs, Agile, Go-to-Market Strategy, RICE Framework, Usability Testing, Kanban, Python, Stakeholder Management","Competitive Analysis, PRD Writing, Customer Discovery","Annual performance bonus, Maternity/paternity leave, MacBook Pro, Mental health support, ₹50K learning budget, Health & dental insurance",Product Management,0.9,match
Neha Mehta,neha.mehta65@gmail.com,+91-9881708143,linkedin.com/in/neha-mehta5,"Mumbai, India",Remote / Hybrid,"Sales leader with 9 years building outbound engines at Adobe. Expert in LinkedIn Sales Navigator, Enterprise Sales and scaling SDR teams from 17 to 31 reps.","Cold Outreach, Account Management, Revenue Forecasting, Upselling, Solution Selling, SPIN Selling, LinkedIn Sales Navigator, Enterprise Sales, BDR, Customer Success",MBA in International Business | VIT Bangalore | 2021 | CGPA: 7.5,Account Executive,Wipro,Ahmedabad / Remote,Full-Time,3+ years,₹8–21 LPA,~18,6,"Upselling, Cold Outreach, Cross-selling, SDR, Customer Success, Account Management, Pipeline Management, Solution Selling, SaaS Sales","Demo Skills, Channel Partnerships, CRM","Gym membership, Flexible work hours, Free meals, Mental health support",Sales,0.75,match
Sneha Banerjee,sneha.banerjee99@gmail.com,+91-9836268597,linkedin.com/in/sneha-banerjee1,"Gurgaon, India",Remote / Hybrid,"10+ years building scalable distributed systems at Atlassian. Deep expertise in Go, Heuristic Evaluation and React. Known for writing clean, well-tested code and driving architectural decisions.","React, Go, FastAPI, REST APIs, Kubernetes, Node.js, Heuristic Evaluation, Design Systems",B.Sc in Computer Science | NMIMS Jaipur | 2013 | CGPA: 8.4,Senior Software Engineer,Zomato,Kolkata / Remote,Full-Time,7+ years,₹10–34 LPA,~20,5,"Microservices, Python, Django, Jenkins, Linux, Redis, React, CI/CD","RabbitMQ, AWS, Terraform","Health & dental insurance, ESOPs, Flexible work hours, Free meals, Annual performance bonus",Software Engineering,0.67,partial match
Meera Naidu,meera.naidu59@gmail.com,+91-9733507484,linkedin.com/in/meera-naidu5,"Mumbai, India",Remote / Hybrid,"Finance professional with 6 years at Airbnb specialising in Tally, IFRS and regulatory compliance. Led teams through 12+ successful audits.","Excel, DCF Analysis, IFRS, Tally, QuickBooks, Budgeting, FP&A, Credit Analysis, Due Diligence, Auditing, Oracle Financials, Risk Analysis",CFA Level II | IIM Delhi | 2021 | CGPA: 8.2 || ---,Investment Analyst,TCS,Pune / Remote,Full-Time,7+ years,₹23–42 LPA,~20,5,"CFA, Accounting, M&A, CA, Treasury, GAAP, Auditing, DCF Analysis, Cash Flow Management, Tally","Excel, IFRS, LBO Modeling","Health & dental insurance, Flexible work hours, Gym membership, MacBook Pro",Finance,0.96,match
Pooja Gupta,pooja.gupta76@gmail.com,+91-9805594047,linkedin.com/in/pooja-gupta1,"Mumbai, India",Remote / Hybrid,HR leader with 8+ years at ICICI Bank specialising in HRIS and Succession Planning. Built hiring pipelines for 13+ roles annually. Reduced attrition by 56% through targeted retention programmes.,"Workday, Performance Management, Labor Law, Workforce Planning, Compensation & Benefits, HRIS, HR Analytics, Organisational Development, LinkedIn Recruiter, Succession Planning, Payroll, Diversity & Inclusion",MBA in Human Resources | NIT Pune | 2019 | CGPA: 7.5 || ---,HR Business Partner,Microsoft,Hyderabad / Remote,Full-Time,2+ years,₹16–65 LPA,~39,5,"Employee Relations, Payroll, HR Analytics, Onboarding, Change Management, SAP HR, LinkedIn Recruiter, Talent Acquisition, SuccessFactors, Exit Management","Performance Management, Workforce Planning, HRIS","₹50K learning budget, Remote-first culture, Health & dental insurance, MacBook Pro",Human Resources,0.86,match
Kabir Pillai,kabir.pillai80@gmail.com,+91-8986468570,linkedin.com/in/kabir-pillai6,"Kochi, India",Remote / Hybrid,"UX researcher and designer with 11 years. Conducted 41+ user studies that directly shaped roadmap decisions. Proficient in PPC, Information Architecture and Storyboarding.","Information Architecture, Sketch, A/B Testing, Zeplin, Storyboarding, PPC, Market Research, Affiliate Marketing",B.F.A in Visual Communication | NMIMS Pune | 2017 | CGPA: 8.0 || ---,Design Systems Engineer,Salesforce,Pune / Remote,Full-Time,7+ years,₹9–42 LPA,~29,6,"Figma, Heuristic Evaluation, Storyboarding, User Research, Wireframing, Lottie, HTML/CSS, Prototyping, Zeplin, Interaction Design","Accessibility (WCAG), InVision, Sketch","Gym membership, ESOPs, Mental health support, Maternity/paternity leave, MacBook Pro, ₹50K learning budget",UI/UX Design,0.48,partial match
Rohit Mehta,rohit.mehta59@gmail.com,+91-8388488388,linkedin.com/in/rohit-mehta4,"Kochi, India",Remote / Hybrid,5+ years driving growth through Cold Outreach and HubSpot at Deloitte. Managed ₹19Cr+ annual marketing budgets. Consistently delivered 51%+ ROI on campaigns.,"LinkedIn Sales Navigator, Salesforce, MEDDIC, HubSpot, Customer Success, Cold Outreach",BBA in Marketing | IIT Kochi | 2012 | CGPA: 7.2 || ---,CISO,MakeMyTrip,Gurgaon / Remote,Full-Time,2+ years,₹10–38 LPA,~35,4,"DLP, NIST Framework, IAM, Python, ISO 27001, SOC Operations, Cryptography, SIEM, Vulnerability Assessment, CISSP","Bash, Incident Response, Burp Suite","Quarterly offsites, Maternity/paternity leave, Gym membership, MacBook Pro, Annual performance bonus",Cybersecurity,0.3,no match
Trisha Kumar,trisha.kumar29@gmail.com,+91-7981323759,linkedin.com/in/trisha-kumar9,"Kochi, India",Remote / Hybrid,"SRE with 3 years ensuring 58% availability for systems serving 22M+ users at Apple. Passionate about Linux, observability, and eliminating toil.","Jenkins, Istio, Linux, Site Reliability Engineering, Customer Success, HubSpot",B.E. in IT | Manipal Kochi | 2017 | CGPA: 9.1 || ---,Cloud Architect,Accenture,Chennai / Remote,Full-Time,5+ years,₹15–34 LPA,~15,5,"New Relic, Grafana, Infrastructure as Code, Nginx, Istio, Pulumi, Datadog, GKE, CloudFormation, Site Reliability Engineering","Bash, Jenkins, Loki","MacBook Pro, Flexible work hours, ESOPs, Quarterly offsites",DevOps,0.59,partial match
Rajesh Bajaj,rajesh.bajaj69@gmail.com,+91-9179638249,linkedin.com/in/rajesh-bajaj6,"Delhi, India",Remote / Hybrid,8+ years as a Data Analyst specialising in Transformers and TensorFlow. Built production ML systems at Lenskart serving 33M+ users. Published 4 internal research papers.,"TensorFlow, PyTorch, Feature Engineering, Transformers, Kafka, BERT, Lottie, User Flows",M.Tech in AI/ML | IIM Mumbai | 2016 | CGPA: 9.5,Senior Data Scientist,Freshworks,Pune / Remote,Full-Time,1+ years,₹10–26 LPA,~14,5,"Spark, Kubeflow, Scikit-learn, MLflow, dbt, R, PyTorch, Looker","Kafka, Statistics, Pandas","MacBook Pro, Remote-first culture, ₹50K learning budget, Quarterly offsites, ESOPs, Annual performance bonus",Data Science,0.59,partial match
Amit Chopra,amit.chopra59@gmail.com,+91-8141943517,linkedin.com/in/amit-chopra1,"Noida, India",Remote / Hybrid,Full-stack engineer with 8 years at companies like Microsoft. Strong in Talent Acquisition and FastAPI. Led rewrites of legacy systems to modern microservices architecture.,"Linux, Redis, TypeScript, FastAPI, System Design, Conflict Resolution, SAP HR, Talent Acquisition, HRIS",B.Tech in Computer Science | BITS Pilani Chennai | 2017 | CGPA: 9.5 || ---,Software Engineer,Unilever,Hyderabad / Remote,Full-Time,2+ years,₹19–58 LPA,~9,4,"Go, FastAPI, CI/CD, SQL, Spring Boot, Rust, Vue.js, Kubernetes, JavaScript, Node.js","Microservices, RabbitMQ, Python","Free meals, Flexible work hours, MacBook Pro, Maternity/paternity leave",Software Engineering,0.71,partial match
Aakash Arora,aakash.arora27@gmail.com,+91-8908122933,linkedin.com/in/aakash-arora9,"Ahmedabad, India",Remote / Hybrid,"2+ years in offensive and defensive security at Zoho. Conducted 41+ penetration tests across web, mobile, and infrastructure. Holder of Bash and CISSP certifications.","Metasploit, CISSP, Bash, Network Security, JIRA, SQL, Competitive Analysis, RICE Framework",B.Tech in Cybersecurity | Delhi University Chennai | 2014 | CGPA: 8.1,Principal Engineer,Zerodha,Hyderabad / Remote,Full-Time,7+ years,₹29–42 LPA,~29,3,"Django, Linux, Redis, JavaScript, Angular, Python, System Design","Java, GCP, CI/CD","Free meals, ESOPs, Mental health support, Flexible work hours",Software Engineering,0.58,partial match
Deepak Tiwari,deepak.tiwari72@gmail.com,+91-7760126127,linkedin.com/in/deepak-tiwari9,"Gurgaon, India",Remote / Hybrid,"Finance professional with 5 years at Infosys specialising in Bloomberg Terminal, CA and regulatory compliance. Led teams through 21+ successful audits.","Bloomberg Terminal, Auditing, Valuation, CA, SAP, HTML/CSS, Accessibility (WCAG), Wireframing, Adobe XD",M.Com in Accounting | Delhi University Noida | 2011 | CGPA: 7.4 || ---,CMO,Meta,Kochi / Remote,Full-Time,4+ years,₹28–74 LPA,~17,3,"Video Marketing, Google Analytics, SEO, Influencer Marketing, Content Marketing, Marketing Automation, Growth Hacking, HubSpot, Adobe Suite","Community Management, Google Ads, Market Research","Free meals, Gym membership, ESOPs, MacBook Pro, Mental health support",Marketing,0.55,partial match
Swati Menon,swati.menon13@gmail.com,+91-8903276542,linkedin.com/in/swati-menon3,"Delhi, India",Remote / Hybrid,InfoSec professional with 9 years at Freshworks specialising in Wireframing and cloud security. Led organisation through ISO 27001 certification and 18+ audits.,"Splunk, Penetration Testing, Threat Intelligence, SOC Operations, IAM, Burp Suite, Wireframing, Design Systems, Visual Design, Lottie",B.Sc in Computer Science | Manipal Kolkata | 2018 | CGPA: 9.3 || ---,CFO,Cognizant,Mumbai / Remote,Full-Time,7+ years,₹20–46 LPA,~24,4,"Valuation, Treasury, Investment Banking, SAP, Accounting, Cash Flow Management, Auditing, Credit Analysis, M&A","Oracle Financials, LBO Modeling, FP&A","Maternity/paternity leave, Flexible work hours, Annual performance bonus, MacBook Pro, Remote-first culture",Finance,0.62,partial match
Nandini Pillai,nandini.pillai78@gmail.com,+91-7290823061,linkedin.com/in/nandini-pillai6,"Bangalore, India",Remote / Hybrid,"5+ years in offensive and defensive security at Salesforce. Conducted 38+ penetration tests across web, mobile, and infrastructure. Holder of Zero Trust and GCP certifications.","Firewalls, Incident Response, PKI, SOC Operations, IAM, Zero Trust, Cloud Security (AWS/GCP), Kubernetes, GCP, New Relic",M.Tech in Information Security | VIT Bangalore | 2019 | CGPA: 9.0,Cloud Security Engineer,PhonePe,Noida / Remote,Full-Time,3+ years,₹15–40 LPA,~13,5,"CEH, Bash, NIST Framework, Network Security, ISO 27001, Splunk","DLP, SOC Operations, OSCP","Mental health support, Gym membership, Free meals, ₹50K learning budget",Cybersecurity,0.74,partial match
Swati Chatterjee,swati.chatterjee74@gmail.com,+91-7648930593,linkedin.com/in/swati-chatterjee3,"Mumbai, India",Remote / Hybrid,Brand and content strategist with 7 years at SAP. Deep expertise in Affiliate Marketing and building engaged communities. Led campaigns reaching 7M+ users.,"SEO, Meta Ads, Marketo, Email Marketing, Social Media, CRM, Adobe Suite, PR, Community Management, SEM, Affiliate Marketing",BBA in Marketing | Manipal Pune | 2018 | CGPA: 8.8 || ---,Brand Manager,Atlassian,Gurgaon / Remote,Full-Time,6+ years,₹14–41 LPA,~8,3,"Social Media, Conversion Rate Optimisation, CRM, Community Management, Growth Hacking, SEO","HubSpot, Google Analytics, Affiliate Marketing","Health & dental insurance, Remote-first culture, Gym membership, ₹50K learning budget, Mental health support, Annual performance bonus",Marketing,0.89,match
Trisha Bajaj,trisha.bajaj40@gmail.com,+91-7311069315,linkedin.com/in/trisha-bajaj4,"Gurgaon, India",Remote / Hybrid,Enterprise sales professional with 11 years at InMobi selling BDR solutions to C-suite buyers. Built and managed pipeline of ₹49Cr+ across 7 industry verticals.,"SaaS Sales, HubSpot, Lead Generation, Cold Outreach, LinkedIn Sales Navigator, Negotiation, Customer Success, SPIN Selling, BDR",B.A. in Business Administration | VIT Kochi | 2009 | CGPA: 8.4 || ---,Sales Manager,boAt,Delhi / Remote,Full-Time,7+ years,₹18–64 LPA,~36,6,"Solution Selling, Enterprise Sales, Upselling, Proposal Writing, B2B Sales, CRM, Cross-selling, Salesforce, Account Management, SPIN Selling","Channel Partnerships, Lead Generation, Revenue Forecasting","Quarterly offsites, Maternity/paternity leave, Flexible work hours, Annual performance bonus, Gym membership, ESOPs",Sales,0.83,match
