name,email,phone,linkedin,Candidate_Location,open_to,summary,skills,education,job_title,company,Job_Location,employment_type,experience,salary,team_size,interview_rounds,required_skills,nice_to_have,perks,domain,match_score,match_label
Kritika Shah,kritika.shah55@gmail.com,+91-9471109191,linkedin.com/in/kritika-shah9,"Ahmedabad, India",Remote / Hybrid,CA/MBA with 5+ years in Valuation and Equity Research at Swiggy. Managed portfolios worth ₹4Cr. Strong track record in cost reduction and financial optimisation.,"CFA, Bloomberg Terminal, Equity Research, CA, Valuation, Growth Hacking, Product Analytics, Roadmapping",B.Com in Finance | Manipal Kochi | 2022 | CGPA: 8.2,FP&A Analyst,Amazon,Delhi / Remote,Full-Time,8+ years,₹23–70 LPA,~12,4,"QuickBooks, Treasury, Credit Analysis, Financial Reporting, GAAP, Investment Banking, SAP, Accounting","LBO Modeling, Excel, CFA","MacBook Pro, Health & dental insurance, Annual performance bonus, Quarterly offsites, Maternity/paternity leave, Flexible work hours",Finance,0.55,partial match
Arjun Verma,arjun.verma70@gmail.com,+91-8411636005,linkedin.com/in/arjun-verma7,"Gurgaon, India",Remote / Hybrid,"Data scientist with 8 years applying B2B Sales, Contract Negotiation and Channel Partnerships to solve complex business problems. Experience across recommendation systems, fraud detection, and demand forecasting.","B2B Sales, SPIN Selling, Contract Negotiation, SDR, LinkedIn Sales Navigator, Channel Partnerships, Account Management, HubSpot",B.Tech in Computer Science | Manipal Gurgaon | 2016 | CGPA: 7.6 || ---,Design Lead,Paytm,Chennai / Remote,Full-Time,2+ years,₹28–66 LPA,~36,3,"Zeplin, Wireframing, Lottie, User Research, User Flows, Sketch","Card Sorting, InVision, Adobe XD","Free meals, Remote-first culture, ₹50K learning budget, Mental health support, Quarterly offsites, Flexible work hours",UI/UX Design,0.27,no match
Manish Bhatt,manish.bhatt89@gmail.com,+91-7228139981,linkedin.com/in/manish-bhatt8,"Gurgaon, India",Remote / Hybrid,"Performance marketer with 8 years scaling user acquisition at Infosys. Expert in Kubernetes, Google Ads and CRM. Grew organic traffic by 11% YoY.","SEM, Google Ads, CRM, PPC, Social Media, Content Marketing, GCP, Grafana, Kubernetes",B.Sc in Mass Communication | NMIMS Ahmedabad | 2022 | CGPA: 9.1 || ---,Security Analyst,KPMG,Delhi / Remote,Full-Time,5+ years,₹14–59 LPA,~29,4,"IAM, Burp Suite, Bash, CISSP, Metasploit, Splunk","DLP, Firewalls, ISO 27001","Flexible work hours, Remote-first culture, MacBook Pro, Mental health support, Annual performance bonus",Cybersecurity,0.46,partial match
Natasha Sharma,natasha.sharma76@gmail.com,+91-7994319947,linkedin.com/in/natasha-sharma5,"Bangalore, India",Remote / Hybrid,"SRE with 5 years ensuring 59% availability for systems serving 8M+ users at Browserstack. Passionate about Spring Boot, observability, and eliminating toil.","Node.js, GitHub Actions, RabbitMQ, Spring Boot, Redis",B.Tech in Computer Science | IIM Kochi | 2016 | CGPA: 9.3,Sales Director,Ola,Gurgaon / Remote,Full-Time,2+ years,₹8–43 LPA,~33,6,"Solution Selling, LinkedIn Sales Navigator, SPIN Selling, Pipeline Management, Negotiation, B2B Sales, HubSpot, Salesforce","Demo Skills, BDR, Account Management","Remote-first culture, ₹50K learning budget, Quarterly offsites, Mental health support, Annual performance bonus",Sales,0.09,no match
Kavya Agarwal,kavya.agarwal75@gmail.com,+91-9108897788,linkedin.com/in/kavya-agarwal6,"Hyderabad, India",Remote / Hybrid,Product designer with 7 years at HCL working across mobile and web platforms. Shipped 10+ end-to-end design projects. Passionate about Data Modeling and inclusive design.,"Visual Design, Prototyping, Wireframing, Information Architecture, Heuristic Evaluation, NLP, Hypothesis Testing, Data Modeling, TensorFlow",M.A. in Design | VIT Jaipur | 2011 | CGPA: 9.2 || ---,Business Development Manager,Salesforce,Bangalore / Remote,Full-Time,5+ years,₹12–49 LPA,~35,3,"SDR, Demo Skills, Cold Outreach, Account Management, Proposal Writing, MEDDIC","Contract Negotiation, Solution Selling, Pipeline Management","Annual performance bonus, Maternity/paternity leave, Quarterly offsites, Free meals, Health & dental insurance, Mental health support",Sales,0.66,partial match
Divya Bhatt,divya.bhatt72@gmail.com,+91-9469172906,linkedin.com/in/divya-bhatt2,"Ahmedabad, India",Remote / Hybrid,"Strategic HRBP with 2 years partnering with business leaders at CRED. Expert in Conversion Rate Optimisation, SEO and building high-performance cultures in fast-scaling organisations.","Programmatic Advertising, Google Analytics, Conversion Rate Optimisation, Content Marketing, Influencer Marketing, SEO, Marketing Automation",PGDM in HR | NIT Kolkata | 2012 | CGPA: 7.8,Senior Data Scientist,EY,Noida / Remote,Full-Time,3+ years,₹22–52 LPA,~30,4,"Kubeflow, Redshift, SQL, Scikit-learn, Airflow, MLflow, A/B Testing","Transformers, BigQuery, PyTorch","MacBook Pro, Quarterly offsites, Gym membership, ESOPs, Health & dental insurance",Data Science,0.11,no match
Varun Naidu,varun.naidu97@gmail.com,+91-7747782210,linkedin.com/in/varun-naidu5,"Kochi, India",Remote / Hybrid,Investment analyst with 11 years covering Tax Compliance and CFA. Built 40+ financial models supporting ₹2Cr+ in deals. CFA Level 3 cleared.,"DCF Analysis, Oracle Financials, Tally, Investment Banking, Tax Compliance, Treasury, Cash Flow Management, CFA, Bloomberg Terminal, LBO Modeling",CA (Chartered Accountant) | BITS Pilani Noida | 2010 | CGPA: 7.6 || ---,Investment Analyst,upGrad,Mumbai / Remote,Full-Time,3+ years,₹17–56 LPA,~27,3,"Valuation, DCF Analysis, Risk Analysis, Investment Banking, Due Diligence, Cash Flow Management, Equity Research, Financial Reporting, CFA","SAP, Accounting, Auditing","ESOPs, MacBook Pro, Mental health support, Flexible work hours",Finance,0.95,match
Vikram Singh,vikram.singh43@gmail.com,+91-8371909152,linkedin.com/in/vikram-singh7,"Hyderabad, India",Remote / Hybrid,"SRE with 4 years ensuring 78% availability for systems serving 17M+ users at Meta. Passionate about Diversity & Inclusion, observability, and eliminating toil.","Performance Management, Exit Management, SAP HR, Conflict Resolution, SuccessFactors, Diversity & Inclusion, Succession Planning, Organisational Development",B.Sc in Computer Science | Manipal Jaipur | 2018 | CGPA: 7.4 || ---,Financial Analyst,Zoho,Hyderabad / Remote,Full-Time,3+ years,₹13–46 LPA,~26,3,"Budgeting, CFA, Investment Banking, Auditing, Credit Analysis, Cash Flow Management, Tally, Bloomberg Terminal, Treasury","GAAP, VBA, QuickBooks","MacBook Pro, Remote-first culture, Flexible work hours, Gym membership, Annual performance bonus, Maternity/paternity leave",Finance,0.17,no match
Ananya Joshi,ananya.joshi19@gmail.com,+91-9876934082,linkedin.com/in/ananya-joshi2,"Gurgaon, India",Remote / Hybrid,"Product manager with 6 years driving 0-to-1 products and scaling existing ones. Deep expertise in Growth Hacking, Product Analytics and working at the intersection of business, design, and engineering.","Product Analytics, Usability Testing, OKRs, Go-to-Market Strategy, Feature Prioritisation, Mixpanel, User Research, Growth Hacking, Python, Competitive Analysis",MBA in Product Management | BITS Pilani Mumbai | 2012 | CGPA: 7.3 || ---,Group Product Manager,Zerodha,Gurgaon / Remote,Full-Time,6+ years,₹20–56 LPA,~12,6,"Feature Prioritisation, RICE Framework, SQL, Python, Wireframing, Usability Testing, User Research, Miro, JIRA, Stakeholder Management","Customer Discovery, Mixpanel, KPIs","Maternity/paternity leave, Remote-first culture, ESOPs, Annual performance bonus, Quarterly offsites",Product Management,0.75,match
Rishabh Banerjee,rishabh.banerjee75@gmail.com,+91-8795537358,linkedin.com/in/rishabh-banerjee9,"Gurgaon, India",Remote / Hybrid,HR leader with 6+ years at ShareChat specialising in Payroll and Labor Law. Built hiring pipelines for 41+ roles annually. Reduced attrition by 16% through targeted retention programmes.,"HRMS, Workday, SuccessFactors, Payroll, Labor Law, Workforce Planning, Training & Development, Employer Branding",B.A. in Psychology | IIM Kolkata | 2020 | CGPA: 8.5,Recruiter,Flipkart,Ahmedabad / Remote,Full-Time,5+ years,₹30–60 LPA,~23,4,"Employer Branding, HRIS, LinkedIn Recruiter, SAP HR, Succession Planning, SuccessFactors, HR Analytics, Employee Relations","Workforce Planning, Training & Development, Organisational Development","Maternity/paternity leave, Free meals, Remote-first culture, MacBook Pro",Human Resources,0.94,match
Aparna Pillai,aparna.pillai79@gmail.com,+91-8992132337,linkedin.com/in/aparna-pillai9,"Gurgaon, India",Remote / Hybrid,Investment analyst with 10 years covering CA and SAP. Built 3+ financial models supporting ₹5Cr+ in deals. CFA Level 1 cleared.,"CA, CFA, SAP, Tax Compliance, Due Diligence, LBO Modeling, HubSpot, BDR",MBA in Finance | NMIMS Kolkata | 2013 | CGPA: 9.3 || ---,Senior Financial Analyst,upGrad,Kolkata / Remote,Full-Time,3+ years,₹19–35 LPA,~18,6,"CA, M&A, Oracle Financials, Financial Reporting, SAP, LBO Modeling, Valuation, Excel, DCF Analysis","Bloomberg Terminal, Equity Research, QuickBooks","Maternity/paternity leave, Quarterly offsites, Remote-first culture, Annual performance bonus, MacBook Pro",Finance,0.55,partial match
Kritika Ghosh,kritika.ghosh58@gmail.com,+91-8747715752,linkedin.com/in/kritika-ghosh4,"Jaipur, India",Remote / Hybrid,"Passionate Backend Developer with 8 years of experience across backend and cloud infrastructure. Proficient in JavaScript, REST APIs, FastAPI. Delivered systems handling millions of requests per day.","Java, JavaScript, Angular, Vue.js, FastAPI, REST APIs, Kafka, Kubernetes",B.E. in Information Technology | Delhi University Delhi | 2018 | CGPA: 8.0 || ---,Senior Software Engineer,SAP,Bangalore / Remote,Full-Time,1+ years,₹16–30 LPA,~32,4,"Node.js, MongoDB, Vue.js, Linux, Docker, Jenkins, SQL, Spring Boot","FastAPI, Angular, Redis","Quarterly offsites, ₹50K learning budget, Gym membership, ESOPs",Software Engineering,0.89,match
Kabir Kulkarni,kabir.kulkarni99@gmail.com,+91-8618213885,linkedin.com/in/kabir-kulkarni8,"Ahmedabad, India",Remote / Hybrid,CA/MBA with 9+ years in Budgeting and Equity Research at Mphasis. Managed portfolios worth ₹46Cr. Strong track record in cost reduction and financial optimisation.,"Valuation, IFRS, Budgeting, Equity Research, M&A, Due Diligence, Tax Compliance, QuickBooks",PGDM in Finance | NIT Bangalore | 2016 | CGPA: 8.6 || ---,Finance Manager,Paytm,Chennai / Remote,Full-Time,4+ years,₹25–50 LPA,~9,5,"Investment Banking, SAP, Valuation, CFA, Risk Analysis, Excel, Tax Compliance, Financial Modeling, Equity Research, QuickBooks","GAAP, DCF Analysis, Treasury","Annual performance bonus, Quarterly offsites, Flexible work hours, ESOPs, Free meals, Gym membership",Finance,0.77,match
Amit Gupta,amit.gupta35@gmail.com,+91-8143826907,linkedin.com/in/amit-gupta6,"Noida, India",Remote / Hybrid,"Security engineer with 8 years building and operating SOC capabilities at Paytm. Expert in Wireshark, OSCP and threat hunting. Reduced MTTD by 49%.","Firewalls, SOC Operations, OSCP, Bash, Wireshark, ISO 27001, DLP, PKI, Cryptography, CISSP, NIST Framework, Incident Response",B.Sc in Computer Science | NIT Ahmedabad | 2011 | CGPA: 8.5 || ---,Penetration Tester,PhonePe,Hyderabad / Remote,Full-Time,9+ years,₹28–75 LPA,~20,6,"Incident Response, SIEM, Zero Trust, Python, PKI, Wireshark, Network Security, DLP, Penetration Testing","Cryptography, Firewalls, Cloud Security (AWS/GCP)","MacBook Pro, ₹50K learning budget, Health & dental insurance, Annual performance bonus",Cybersecurity,0.9,match
Pallavi Choudhary,pallavi.choudhary86@gmail.com,+91-7955522471,linkedin.com/in/pallavi-choudhary1,"Pune, India",Remote / Hybrid,"Finance professional with 10 years at PwC specialising in CFA, Tally and regulatory compliance. Led teams through 50+ successful audits.","LBO Modeling, QuickBooks, Credit Analysis, CFA, Tally, Accounting, MoSCoW, PRD Writing, Wireframing, Mixpanel",M.Sc in Finance | NIT Jaipur | 2018 | CGPA: 9.1 || ---,Credit Analyst,HCL,Jaipur / Remote,Full-Time,9+ years,₹23–68 LPA,~10,3,"Investment Banking, GAAP, SAP, QuickBooks, M&A, Cash Flow Management, Bloomberg Terminal","Valuation, Financial Reporting, CA","Quarterly offsites, Free meals, MacBook Pro, Health & dental insurance, Flexible work hours",Finance,0.4,partial match
Kavya Malhotra,kavya.malhotra66@gmail.com,+91-7374488721,linkedin.com/in/kavya-malhotra7,"Hyderabad, India",Remote / Hybrid,"7+ years building scalable distributed systems at TCS. Deep expertise in Vulnerability Assessment, OWASP Top 10 and Forensics. Known for writing clean, well-tested code and driving architectural decisions.","Zero Trust, DLP, OWASP Top 10, Vulnerability Assessment, CISSP, OSCP, Forensics",M.Tech in Software Engineering | BITS Pilani Kochi | 2016 | CGPA: 8.0,UX Researcher,Apple,Hyderabad / Remote,Full-Time,1+ years,₹21–62 LPA,~15,3,"Motion Design, Figma, Interaction Design, User Flows, Prototyping, Principle, Lottie, Wireframing","Sketch, InVision, A/B Testing","MacBook Pro, ₹50K learning budget, Quarterly offsites, Remote-first culture, ESOPs, Annual performance bonus",UI/UX Design,0.12,no match
Swati Das,swati.das77@gmail.com,+91-9837839278,linkedin.com/in/swati-das9,"Delhi, India",Remote / Hybrid,"SRE with 7 years ensuring 80% availability for systems serving 13M+ users at Infosys. Passionate about Incident Response, observability, and eliminating toil.","SOC Operations, PKI, Vulnerability Assessment, Zero Trust, Wireshark, OSCP, SIEM, Incident Response",B.Sc in Computer Science | NMIMS Chennai | 2015 | CGPA: 9.5,Head of HR,Cognizant,Bangalore / Remote,Full-Time,6+ years,₹12–30 LPA,~19,3,"Employer Branding, Succession Planning, Compensation & Benefits, Exit Management, Organisational Development, SAP HR, Conflict Resolution, HR Analytics, Change Management","Performance Management, HRIS, Onboarding","Annual performance bonus, Health & dental insurance, Flexible work hours, ₹50K learning budget, MacBook Pro, Maternity/paternity leave",Human Resources,0.19,no match
Vikram Patel,vikram.patel13@gmail.com,+91-7123957232,linkedin.com/in/vikram-patel2,"Jaipur, India",Remote / Hybrid,"11+ years in offensive and defensive security at SAP. Conducted 26+ penetration tests across web, mobile, and infrastructure. Holder of Financial Reporting and Credit Analysis certifications.","Credit Analysis, Financial Modeling, Oracle Financials, Financial Reporting",B.E. in Computer Engineering | Manipal Bangalore | 2019 | CGPA: 7.2,Group Product Manager,Lenskart,Mumbai / Remote,Full-Time,5+ years,₹12–27 LPA,~17,4,"Usability Testing, JIRA, A/B Testing, Customer Discovery, Miro, KPIs, RICE Framework, User Research, Agile","Mixpanel, Confluence, Roadmapping","Remote-first culture, Quarterly offsites, Mental health support, Annual performance bonus, Health & dental insurance, Maternity/paternity leave",Product Management,0.1,no match
Suresh Shah,suresh.shah27@gmail.com,+91-7255983246,linkedin.com/in/suresh-shah1,"Kochi, India",Remote / Hybrid,"12+ years in offensive and defensive security at InMobi. Conducted 42+ penetration tests across web, mobile, and infrastructure. Holder of NIST Framework and Threat Intelligence certifications.","SIEM, Splunk, Threat Intelligence, Cryptography, Zero Trust, OSCP, Metasploit, ISO 27001, NIST Framework",M.S. in Cybersecurity | IIM Delhi | 2010 | CGPA: 8.4,CISO,Meta,Ahmedabad / Remote,Full-Time,4+ years,₹23–72 LPA,~21,5,"Bash, Threat Intelligence, Wireshark, SOC Operations, CEH, Metasploit, Zero Trust, IAM, CISSP, OSCP","Burp Suite, ISO 27001, Penetration Testing","Flexible work hours, ESOPs, Maternity/paternity leave, ₹50K learning budget",Cybersecurity,0.76,match
Trisha Nair,trisha.nair53@gmail.com,+91-8939018541,linkedin.com/in/trisha-nair1,"Kolkata, India",Remote / Hybrid,InfoSec professional with 12 years at Meesho specialising in OWASP Top 10 and cloud security. Led organisation through ISO 27001 certification and 31+ audits.,"Penetration Testing, Splunk, OWASP Top 10, Vulnerability Assessment, Incident Response, Cloud Security (AWS/GCP), CISSP, ISO 27001",M.S. in Cybersecurity | IIM Pune | 2010 | CGPA: 8.8,Cloud Security Engineer,Amazon,Kochi / Remote,Full-Time,1+ years,₹15–60 LPA,~39,6,"OWASP Top 10, Firewalls, Network Security, Zero Trust, Vulnerability Assessment, Wireshark","Bash, Splunk, Cloud Security (AWS/GCP)","Remote-first culture, MacBook Pro, Free meals, Annual performance bonus, Health & dental insurance",Cybersecurity,0.79,match
Zara Das,zara.das76@gmail.com,+91-7365435516,linkedin.com/in/zara-das4,"Mumbai, India",Remote / Hybrid,"Passionate Software Engineer with 11 years of experience across backend and cloud infrastructure. Proficient in Miro, Kanban, Mixpanel. Delivered systems handling millions of requests per day.","Roadmapping, Mixpanel, KPIs, Miro, Wireframing, Agile, Kanban",B.Tech in Computer Science | NMIMS Mumbai | 2019 | CGPA: 8.8,Growth Manager,Flipkart,Pune / Remote,Full-Time,9+ years,₹11–28 LPA,~20,6,"Salesforce, SEM, Conversion Rate Optimisation, Influencer Marketing, Copywriting, SEO, Affiliate Marketing, Email Marketing, Content Marketing","Marketing Automation, Growth Hacking, Meta Ads","Gym membership, Health & dental insurance, ESOPs, Annual performance bonus, Mental health support, ₹50K learning budget",Marketing,0.32,no match
Natasha Pandey,natasha.pandey14@gmail.com,+91-9975445372,linkedin.com/in/natasha-pandey4,"Pune, India",Remote / Hybrid,Growth-focused PM with 5 years at Ola. Grew core metrics by 28% through disciplined KPIs and rigorous experimentation.,"Scrum, Confluence, Product Analytics, SQL, Python, A/B Testing, Figma, Miro, KPIs",B.Tech in Computer Science | IIM Jaipur | 2018 | CGPA: 7.2,Director of Product,Vedantu,Hyderabad / Remote,Full-Time,2+ years,₹22–70 LPA,~38,6,"SQL, Scrum, Miro, Confluence, Figma, JIRA, Amplitude, KPIs, Feature Prioritisation, Stakeholder Management","Product Analytics, Wireframing, RICE Framework","Quarterly offsites, ₹50K learning budget, Gym membership, Free meals, Health & dental insurance",Product Management,0.9,match
Siddharth Pillai,siddharth.pillai27@gmail.com,+91-8970088751,linkedin.com/in/siddharth-pillai4,"Kolkata, India",Remote / Hybrid,"11+ years in offensive and defensive security at Oracle. Conducted 25+ penetration tests across web, mobile, and infrastructure. Holder of Firewalls and Cold Outreach certifications.","Firewalls, Threat Intelligence, IAM, Bash, Cold Outreach, LinkedIn Sales Navigator",B.Tech in Cybersecurity | BITS Pilani Jaipur | 2018 | CGPA: 8.6,Security Engineer,Zerodha,Ahmedabad / Remote,Full-Time,4+ years,₹26–57 LPA,~36,5,"DLP, Python, Forensics, Cloud Security (AWS/GCP), Threat Intelligence, Splunk, OWASP Top 10, ISO 27001","SIEM, Vulnerability Assessment, Wireshark","₹50K learning budget, Free meals, Mental health support, ESOPs, Annual performance bonus",Cybersecurity,0.43,partial match
Arjun Verma,arjun.verma82@gmail.com,+91-8491854778,linkedin.com/in/arjun-verma6,"Delhi, India",Remote / Hybrid,4+ years driving growth through GitHub Actions and Prometheus at Paytm. Managed ₹36Cr+ annual marketing budgets. Consistently delivered 74%+ ROI on campaigns.,"Prometheus, GitHub Actions, Ansible, Datadog, Bash",M.A. in Communications | NMIMS Mumbai | 2015 | CGPA: 8.2 || ---,Finance Manager,upGrad,Noida / Remote,Full-Time,1+ years,₹30–66 LPA,~9,3,"Accounting, LBO Modeling, Auditing, Financial Modeling, FP&A, Bloomberg Terminal, CFA, Risk Analysis","Valuation, Credit Analysis, Equity Research","Free meals, Gym membership, Flexible work hours, Quarterly offsites, MacBook Pro",Finance,0.36,no match
Karan Ghosh,karan.ghosh98@gmail.com,+91-9825099233,linkedin.com/in/karan-ghosh3,"Bangalore, India",Remote / Hybrid,4+ years of product leadership at Google. Shipped 33+ features impacting millions of users. Passionate about NLP and building data-driven product culture.,"Go-to-Market Strategy, Wireframing, Customer Discovery, Agile, NLP, R, MLflow",B.E. in Electronics | NMIMS Chennai | 2011 | CGPA: 7.6 || ---,Director of Product,Cognizant,Kolkata / Remote,Full-Time,8+ years,₹17–28 LPA,~19,5,"Mixpanel, Product Analytics, Go-to-Market Strategy, A/B Testing, MoSCoW, Growth Hacking, Roadmapping, Usability Testing, Customer Discovery, Scrum","Miro, Confluence, PRD Writing","Maternity/paternity leave, Free meals, ₹50K learning budget, MacBook Pro, Gym membership, Health & dental insurance",Product Management,0.6,partial match
Rohan Rao,rohan.rao93@gmail.com,+91-9961084719,linkedin.com/in/rohan-rao7,"Kolkata, India",Remote / Hybrid,"Product manager with 3 years driving 0-to-1 products and scaling existing ones. Deep expertise in Confluence, RICE Framework and working at the intersection of business, design, and engineering.","Confluence, Product Analytics, Python, User Research, Miro, KPIs, MoSCoW, RICE Framework, Amplitude, Agile, Kanban, Customer Discovery",MBA in Product Management | Manipal Mumbai | 2014 | CGPA: 7.7,Group Product Manager,upGrad,Noida / Remote,Full-Time,7+ years,₹23–44 LPA,~17,4,"A/B Testing, PRD Writing, RICE Framework, Competitive Analysis, Product Analytics, KPIs","Roadmapping, JIRA, Agile","Annual performance bonus, MacBook Pro, Flexible work hours, Remote-first culture, Health & dental insurance",Product Management,0.97,match
Nikhil Mehta,nikhil.mehta45@gmail.com,+91-7102103065,linkedin.com/in/nikhil-mehta7,"Ahmedabad, India",Remote / Hybrid,"Sales leader with 6 years building outbound engines at Groww. Expert in Customer Discovery, Python and scaling SDR teams from 3 to 45 reps.","SaaS Sales, Proposal Writing, B2B Sales, Account Management, Demo Skills, Pipeline Management, Channel Partnerships, Customer Discovery, Roadmapping, Python",PGDM in Sales | IIT Chennai | 2019 | CGPA: 7.6 || ---,SDR,IBM,Jaipur / Remote,Full-Time,3+ years,₹12–48 LPA,~9,3,"Contract Negotiation, Lead Generation, BDR, SDR, Enterprise Sales, Customer Success, Upselling","Cross-selling, B2B Sales, Salesforce","Gym membership, Health & dental insurance, Remote-first culture, ₹50K learning budget",Sales,0.7,partial match
Kunal Nair,kunal.nair16@gmail.com,+91-7301645728,linkedin.com/in/kunal-nair3,"Kochi, India",Remote / Hybrid,CA/MBA with 10+ years in HRMS and Succession Planning at Zomato. Managed portfolios worth ₹47Cr. Strong track record in cost reduction and financial optimisation.,"Training & Development, SAP HR, Succession Planning, Payroll, LinkedIn Recruiter, HRMS, Talent Acquisition, Exit Management",CFA Level II | BITS Pilani Gurgaon | 2020 | CGPA: 8.2,SOC Analyst,Meesho,Mumbai / Remote,Full-Time,7+ years,₹15–25 LPA,~23,4,"CEH, SOC Operations, Penetration Testing, Bash, Wireshark, OSCP, OWASP Top 10, IAM, Forensics, Incident Response","Network Security, DLP, Burp Suite","ESOPs, Flexible work hours, Health & dental insurance, Gym membership",Cybersecurity,0.35,no match
Rahul Shah,rahul.shah68@gmail.com,+91-8267011535,linkedin.com/in/rahul-shah1,"Chennai, India",Remote / Hybrid,CA/MBA with 7+ years in CA and M&A at Microsoft. Managed portfolios worth ₹44Cr. Strong track record in cost reduction and financial optimisation.,"FP&A, M&A, Treasury, CA, CFA, Risk Analysis, TypeScript, Elasticsearch",PGDM in Finance | Delhi University Jaipur | 2020 | CGPA: 7.3 || ---,Financial Analyst,PhonePe,Mumbai / Remote,Full-Time,9+ years,₹13–43 LPA,~27,4,"VBA, Tally, GAAP, Excel, Cash Flow Management, Risk Analysis","Tax Compliance, Equity Research, DCF Analysis","Remote-first culture, ESOPs, Quarterly offsites, Mental health support, Annual performance bonus, ₹50K learning budget",Finance,0.7,partial match
Rahul Choudhary,rahul.choudhary98@gmail.com,+91-9185493989,linkedin.com/in/rahul-choudhary1,"Mumbai, India",Remote / Hybrid,HR leader with 2+ years at Amazon specialising in VBA and Talent Acquisition. Built hiring pipelines for 27+ roles annually. Reduced attrition by 16% through targeted retention programmes.,"Diversity & Inclusion, SuccessFactors, HR Analytics, Workforce Planning, Employer Branding, Talent Acquisition, IFRS, DCF Analysis, VBA, Budgeting",MBA in Human Resources | NMIMS Ahmedabad | 2017 | CGPA: 9.3 || ---,HR Business Partner,Goldman Sachs,Bangalore / Remote,Full-Time,4+ years,₹19–43 LPA,~31,5,"Workday, Onboarding, Organisational Development, Payroll, Employee Relations, SAP HR, Labor Law, Training & Development, Exit Management","LinkedIn Recruiter, HR Analytics, Workforce Planning","ESOPs, MacBook Pro, Mental health support, ₹50K learning budget",Human Resources,0.5,partial match
Ishita Agarwal,ishita.agarwal37@gmail.com,+91-7201620507,linkedin.com/in/ishita-agarwal1,"Ahmedabad, India",Remote / Hybrid,Investment analyst with 11 years covering Content Marketing and Growth Hacking. Built 34+ financial models supporting ₹2Cr+ in deals. CFA Level 2 cleared.,"PPC, Marketing Automation, Content Marketing, SEM, PR, Growth Hacking, HubSpot",B.Com in Finance | Manipal Delhi | 2018 | CGPA: 8.4,Senior AE,Uber,Bangalore / Remote,Full-Time,5+ years,₹22–67 LPA,~21,3,"Cold Outreach, Customer Success, SDR, Revenue Forecasting, Negotiation, SPIN Selling","HubSpot, B2B Sales, MEDDIC","Maternity/paternity leave, ESOPs, Gym membership, Quarterly offsites",Sales,0.28,no match
